country,title,detail,project_link
Uganda,"Safe drinking water for 20 schools in Uganda","We will install 30 drinking water filters and 40 pedal handwashing facilities in 20 schools to reduce water-borne diseases such as diarrhea … read more",https://www.globalgiving.org/projects/improving-safe-drinking-and-handwashing-in-schools/
Togo,"Sufficient drinking water to save human lives","At the request of 2 communities, NGO CAV proposes to implement a support program for access to improved water sources. This project includes… read more",https://www.globalgiving.org/projects/sufficient-drinking-water-to-save-human-lives/
Guatemala,"Water Filters Provide Only Clean Water Source","Diarrhea is directly linked to contaminated water. Simple water filtration systems reduce the risk of preventable waterborne illness like ch… read more",https://www.globalgiving.org/projects/water-filters/
Nigeria,"SOLAR WATER SUPPLY TO 4,000 PEOPLE OF AWALA VILAGE","The project will construct: 1. 4 NUMBER OF HUMAN DRINKING STANDS for water consumption. 2. ANIMALS' DRINKING TROUGH where 1,000 animals and … read more",https://www.globalgiving.org/projects/provision-of-water-and-gardens-in-awala-village/
Uganda,"Clean Water Supply to 200000 People in Uganda.","Your donation will aim at supporting of 5 boreholes, 5 spring water source, 1 solar powered water source and 10 rainwater harvesting water t… read more",https://www.globalgiving.org/projects/clean-water-supply-to-200000-people-in-uganda/
Pakistan,"Drink water filter plant for rural  people","In Pajian village, rural people have no clean water to drink . They drink from handpump or a male go far away to bring water for family. Fem… read more",https://www.globalgiving.org/projects/drink-water-filter-plant-for-rural-people/
Ghana,"Clean Water for 100 Communities in Ghana","This project seeks to construct and donate mechanized borehole to marginalized communities in the Northern, Eastern and Western part of Ghan… read more",https://www.globalgiving.org/projects/clean-water-for-100-communities-in-ghana/
Uganda,"Clean Water for 2,500 Women & Children in Uganda","This project will build a clean water source in remote village in NE Uganda.  2,500 in Nakisilet Village are in dire need of a clean water b… read more",https://www.globalgiving.org/projects/clean-water-for-2500-women-and-children-in-uganda/
Puerto Rico,"ISER Caribe Water & Climate Change Lab","The goal of our fundraising is to jumpstart the Water & Climate Change Lab. Water, along with energy, food, healthcare, and communications, … read more",https://www.globalgiving.org/projects/iser-caribe-water-lab/
China,"Sponge community in rural China for cleaner river","This project will build a 400 square kilometers rain garden in rural area of Beijing, and solve the problem caused by rainwater in rural are… read more",https://www.globalgiving.org/projects/sponge-community-in-rural-area-for-a-cleaner-river/
Nigeria,"Water & Sanitary Facilities for Ajegunle Slums","This  project will provide  clean water and sanitary facilities for  a community in Ajegunle, Nigeria's most notorious slum.  Funds will sup… read more",https://www.globalgiving.org/projects/portable-water-for-ajegunles-slum-communities/
Nigeria,"Support for eradicating water crisis in Gulani LGA","A successful survey conducted by HOPLE were we find out some communities are in difficult situation regarding water challenge especially in … read more",https://www.globalgiving.org/projects/call-for-support-to-eradicate-water-crisis-in-gln/
Tanzania, United Republic of,"WATER PROJECT IN TANZANIAN SCHOOLS","This project will provide access to clean and safe water services to 6000 schoolchildren in rural areas of Iringa, Tanzania who do not have … read more",https://www.globalgiving.org/projects/water-project-in-tanzanian-schools/
Uganda,"Provide Clean Water in Uganda","In Uganda's Pallisa, Butalenja, Budaka, and Butebo regions, thousands suffer due to a lack of clean water, causing waterborne diseases. Huma… read more",https://www.globalgiving.org/projects/hicleanwateruganda/
Colombia,"Citizen science as a catalyst for the water action","Goals 6.6 and 6.b of SDG 6, according to official data from ECLAC, are goals whose trend is moving away from the possibility of being able t… read more",https://www.globalgiving.org/projects/citizen-science-as-a-catalyst-for-the-water-action/
Malawi,"A new borehole in Malawi","This project has the aim to build a new borehole in Malawi, Africa.  Each borehole will provide access to clean and safe water to an estimat… read more",https://www.globalgiving.org/projects/a-new-borehole-in-malawi/
Nigeria,"Give Water Save Life","This project will construct Three (3) water boreholes for the three identified communities in Nigeria for them to have safe and clean water … read more",https://www.globalgiving.org/projects/give-water-save-life/
Argentina,"Build 20 Hand Washing & Sanitation Stations","Over 700 children under age 5 die every day world wide of diarrhoeal diseases due to lack of appropriate hand washing practices and infrastr… read more",https://www.globalgiving.org/projects/build-20-hand-washing-stations/
Tanzania, United Republic of,"High Density Water Pipe Rolls Project","The project targets to provide 18 rolls of high density black plastic water pipe rolls to Nkoansiyo village which do not have access to wate… read more",https://www.globalgiving.org/projects/high-density-water-pipe-rolls/
Senegal,"The Boring Project","We are dedicated to bringing a sustainable source of safely managed water to those in need.   The primary focus of our work is centred on of… read more",https://www.globalgiving.org/projects/the-boring-project/
Ethiopia,"Ensuring Access to Clean Water and Sanitation","Unfortunately, at present, many communities in Ethiopia lack access to clean and safe water. As a result, hygiene and sanitation are often s… read more",https://www.globalgiving.org/projects/ensuring-access-to-clean-water-and-sanitation/
Cambodia,"Cleaning water for poor children in Cambodia","Phnom Srouch district, more than 85% of the people ae agriculture as mango that is a potential crop after the rice crop, which is creating o… read more",https://www.globalgiving.org/projects/safe-water-for-poor-children-in-cambodia/
